{"acceptance_actor_provenance":{"actor_id":"p4-r01-i02-data-custodian","session_id":"/root/independent_readiness_audit","task_record_path":"artifacts/phase-4-prep/p4-prep-phase4-mvp-20260813-r01-i02/control/actor-records/data-custodian.json","task_record_sha256":"8392dfdbd73bd7bbe1a4364212be0fe90417813f8d07686b535048d18378946b"},"actor_assignment_sha256":"1afa96468b5eda6f1969ebfcdcd053cdab2357722d9bc27267293f6a1b4dfeb0","artifact_type":"phase4_work_item_receipt","command":["/usr/bin/python3","scripts/phase4/freeze_authority.py","--prep-id","p4-prep-phase4-mvp-20260813-r01-i02","--commit","b6dcb2b575abb12046985c4cbcd9fb2367549d48","--phase3-release","P3-R07-2c0fa97-20260810-I01","--protected-root","artifacts/phase-0","--protected-root","artifacts/phase-0-multisource","--protected-root","artifacts/phase-1","--protected-root","artifacts/phase-2","--protected-root","artifacts/phase-2.1","--protected-root","artifacts/phase-3","--output","artifacts/phase-4-prep/p4-prep-phase4-mvp-20260813-r01-i02/work-items/T00","--actor-assignments","artifacts/phase-4-prep/p4-prep-phase4-mvp-20260813-r01-i02/control/actor-assignments-preparation.json"],"ended_at_utc":"2026-08-13T01:42:34Z","identity":"p4-prep-phase4-mvp-20260813-r01-i02","inputs":[{"path":"config/phase4/authority-freeze.json","sha256":"6c773a5d5321f1e2eaf4a7e08ba39ab9230341f47d7cbab9357be7758f26dfa8"},{"path":"config/phase4/genesis.json","sha256":"7564e8bacc999e58ef7cda61f4c56e14f148958be4c852266dcddfbb4878249a"},{"path":"artifacts/phase-4-prep/p4-prep-phase4-mvp-20260813-r01-i02/control/actor-assignments-preparation.json","sha256":"1afa96468b5eda6f1969ebfcdcd053cdab2357722d9bc27267293f6a1b4dfeb0"}],"outputs":[{"bytes":1134,"path":"artifacts/phase-4-prep/p4-prep-phase4-mvp-20260813-r01-i02/work-items/T00/authority-inventory.json","producer_actor_id":"p4-r01-i02-controller","role":"release_controller","session_id":"/root","sha256":"cca657a0a6afffa145ef48065f3dc0db559061f62abd57762e83e7cb68fcc8e7","source_commit":"b6dcb2b575abb12046985c4cbcd9fb2367549d48","task_id":"T00"},{"bytes":1929,"path":"artifacts/phase-4-prep/p4-prep-phase4-mvp-20260813-r01-i02/work-items/T00/genesis-verification.json","producer_actor_id":"p4-r01-i02-controller","role":"release_controller","session_id":"/root","sha256":"0e4f51798679abd497093773db5e99218fa4e93a1c68c52d6d04f8ee04e00a59","source_commit":"b6dcb2b575abb12046985c4cbcd9fb2367549d48","task_id":"T00"},{"bytes":1336,"path":"artifacts/phase-4-prep/p4-prep-phase4-mvp-20260813-r01-i02/work-items/T00/namespace-verification.json","producer_actor_id":"p4-r01-i02-controller","role":"release_controller","session_id":"/root","sha256":"5e7c1f42efd042aa4a61acf6fef87d2d2cbc4adb910f89633066ff27aa0e296e","source_commit":"b6dcb2b575abb12046985c4cbcd9fb2367549d48","task_id":"T00"},{"bytes":5724796,"path":"artifacts/phase-4-prep/p4-prep-phase4-mvp-20260813-r01-i02/work-items/T00/protected-artifact-inventory.json","producer_actor_id":"p4-r01-i02-controller","role":"release_controller","session_id":"/root","sha256":"3f88ffd81f00c97ed458473bf3b7886405154e3ab6b5d12e9c7027c9a415e499","source_commit":"b6dcb2b575abb12046985c4cbcd9fb2367549d48","task_id":"T00"},{"bytes":565,"path":"artifacts/phase-4-prep/p4-prep-phase4-mvp-20260813-r01-i02/work-items/T00/role-audit.json","producer_actor_id":"p4-r01-i02-controller","role":"release_controller","session_id":"/root","sha256":"848e6685079ed0223c533597d12cbf892ea02688b5d0d835c7455443773ba921","source_commit":"b6dcb2b575abb12046985c4cbcd9fb2367549d48","task_id":"T00"}],"process_exit_code":0,"role_inequalities":{"acceptance_not_product":true,"delivery_statement_is_machine":true,"power_not_oracle":true,"power_not_product":true,"power_not_statistical":true,"t00_acceptor_not_t00_producer":true},"schema_version":"1.0.0","source_commit":"b6dcb2b575abb12046985c4cbcd9fb2367549d48","started_at_utc":"2026-08-13T01:42:16Z","status":"PASS","task_id":"T00","task_producer_set":["p4-r01-i02-controller"],"terminal":"T00_AUTHORITY_GENESIS_PROTECTION_FROZEN"}
