{"acceptance_actor_provenance":{"actor_id":"p4-r01-i02-controller","session_id":"/root","task_record_path":"artifacts/phase-4-prep/p4-prep-phase4-mvp-20260813-r01-i02/control/actor-records/controller.json","task_record_sha256":"2a745a9669ea981eef9f1b374ddd7b00f252390b2151bf868bb279baa0656859"},"actor_assignment_sha256":"1afa96468b5eda6f1969ebfcdcd053cdab2357722d9bc27267293f6a1b4dfeb0","artifact_type":"phase4_work_item_receipt","command":["/usr/bin/python3","scripts/phase4/write_task_receipt.py","--task","T11","--terminal","T11_PRODUCT_VALIDATION_PASS","--output","artifacts/phase-4-prep/p4-prep-phase4-mvp-20260813-r01-i02/work-items/T11-I04/receipt.json","--input","artifacts/phase-4-prep/p4-prep-phase4-mvp-20260813-r01-i02/work-items/T10/receipt.json","--artifact","artifacts/phase-4-prep/p4-prep-phase4-mvp-20260813-r01-i02/work-items/T11-I02/e2e/e2e-manifest.json","--actor","p4-r01-i02-acceptance-engineer","--session","/root/acceptance_engineer_r01_i02","--role","acceptance_engineer","--source-commit","16d68db1ac52531e05fbbe9b46e4471f3b3450ea","--actor-assignments","artifacts/phase-4-prep/p4-prep-phase4-mvp-20260813-r01-i02/control/actor-assignments-preparation.json","--acceptor-role","release_controller"],"ended_at_utc":"2026-08-13T01:56:25.392677Z","identity":"T11-I04","inputs":[{"path":"artifacts/phase-4-prep/p4-prep-phase4-mvp-20260813-r01-i02/work-items/T10/receipt.json","sha256":"7687ab0569ff7a254cf35474be8944eca32fc3aa609a1d880cbe5a75a5dfaab6"}],"outputs":[{"bytes":9402,"path":"artifacts/phase-4-prep/p4-prep-phase4-mvp-20260813-r01-i02/work-items/T11-I02/e2e/e2e-manifest.json","producer_actor_id":"p4-r01-i02-acceptance-engineer","role":"acceptance_engineer","session_id":"/root/acceptance_engineer_r01_i02","sha256":"bbdf5735fd02f6966afeaf9c5bdbe5632b9e0cca7b76f7f0ea9343c127fa6b05","source_commit":"16d68db1ac52531e05fbbe9b46e4471f3b3450ea","task_id":"T11"}],"process_exit_code":0,"role_inequalities":{"producer_acceptor_distinct":true},"schema_version":"1.0.0","source_commit":"16d68db1ac52531e05fbbe9b46e4471f3b3450ea","started_at_utc":"2026-08-13T01:56:25.392677Z","status":"PASS","task_id":"T11","task_producer_set":["p4-r01-i02-acceptance-engineer"],"terminal":"T11_PRODUCT_VALIDATION_PASS"}